[
  {
    "scenario_id": "agent-001-consent-decline",
    "input": {
      "caller_id": "08030000001",
      "transcript": "Network dina ya daina aiki, babu signal kwata-kwata. Do not record or process this call.",
      "area": "Evaluation Area 01",
      "cell_id": "eval-001",
      "language_pair": "Hausa-English",
      "consent": false
    },
    "hypotheses": {},
    "seed": {},
    "expected": {
      "analysis": {
        "language_pair": "Hausa-English",
        "symptom": "unknown",
        "consent": false
      },
      "outcome": "consent_declined",
      "tier": "complete",
      "next_action": null,
      "exact_tools": [],
      "exact_database_rows": {
        "call_sessions": 1,
        "action_events": 0,
        "complaint_signals": 0,
        "candidate_incidents": 0,
        "tickets": 0,
        "compensation_commands": 0,
        "callback_commands": 0
      },
      "required_response_terms": [
        "processing are off"
      ],
      "critical": {
        "forbidden_pii_values": [
          "08030000001"
        ]
      }
    }
  },
  {
    "scenario_id": "agent-002-known-fault-eligible",
    "input": {
      "caller_id": "08030000002",
      "transcript": "Network dina ya daina aiki, babu signal kwata-kwata. I consent to automated processing.",
      "area": "Evaluation Area 02",
      "cell_id": "EVAL-002",
      "language_pair": "Hausa-English",
      "consent": true
    },
    "hypotheses": {},
    "seed": {
      "incidents": [
        {
          "incident_id": "INC-EVAL-002",
          "operator": "Evaluation Mobile",
          "cell_id": "EVAL-002",
          "area": "Evaluation Area 02",
          "fault_type": "fibre cut",
          "status": "active",
          "cause": "verified civil works",
          "estimated_restoration": "2026-09-13T18:00:00+00:00",
          "source_system": "evaluation-noc",
          "source_reference": "alarm-002",
          "verified_at": "2026-09-13T08:00:00+00:00"
        }
      ],
      "accounts": [
        {
          "caller_id": "08030000002",
          "data_balance_mb": 2048,
          "barred": false,
          "compensation_eligible": true,
          "source_system": "evaluation-crm",
          "source_reference": "frozen-scenario",
          "verified_at": "2026-09-13T08:00:00+00:00"
        }
      ]
    },
    "expected": {
      "analysis": {
        "language_pair": "Hausa-English",
        "symptom": "no_service",
        "consent": true
      },
      "outcome": "known_fault_handled",
      "tier": "complete",
      "next_action": null,
      "exact_tools": [
        "lookup_fault",
        "inspect_account",
        "queue_compensation",
        "schedule_callback"
      ],
      "exact_database_rows": {
        "call_sessions": 1,
        "action_events": 4,
        "complaint_signals": 0,
        "candidate_incidents": 0,
        "tickets": 0,
        "compensation_commands": 1,
        "callback_commands": 1
      },
      "required_response_terms": [
        "active fibre cut",
        "Evaluation Area 02",
        "scheduled an update"
      ],
      "critical": {
        "forbidden_pii_values": [
          "08030000002"
        ]
      }
    }
  },
  {
    "scenario_id": "agent-004-guided-playbook",
    "input": {
      "caller_id": "08030000004",
      "transcript": "Ina da signal amma mobile data ba ya aiki. I consent to automated processing.",
      "area": "Evaluation Area 04",
      "cell_id": "EVAL-004",
      "language_pair": "Hausa-English",
      "consent": true
    },
    "hypotheses": {},
    "seed": {
      "accounts": [
        {
          "caller_id": "08030000004",
          "data_balance_mb": 2048,
          "barred": false,
          "compensation_eligible": false,
          "source_system": "evaluation-crm",
          "source_reference": "frozen-scenario",
          "verified_at": "2026-09-13T08:00:00+00:00"
        }
      ],
      "playbooks": [
        {
          "playbook_id": "00000000-0000-4000-8000-000000000004",
          "issue_type": "data_unavailable",
          "title": "Verified service recovery steps",
          "steps": [
            "Open network settings and select automatic registration"
          ],
          "language_pair": "Hausa-English",
          "operator": null,
          "device_os": null,
          "status": "approved",
          "source_system": "evaluation-runbook",
          "source_reference": "runbook-004",
          "verified_at": "2026-09-13T08:00:00+00:00",
          "version": 1
        }
      ]
    },
    "expected": {
      "analysis": {
        "language_pair": "Hausa-English",
        "symptom": "data_unavailable",
        "consent": true
      },
      "outcome": "awaiting_verification",
      "tier": "diagnosis",
      "next_action": "toggle_airplane_mode",
      "exact_tools": [
        "lookup_fault",
        "inspect_account",
        "lookup_playbook"
      ],
      "exact_database_rows": {
        "call_sessions": 1,
        "action_events": 3,
        "complaint_signals": 0,
        "candidate_incidents": 0,
        "tickets": 0,
        "compensation_commands": 0,
        "callback_commands": 0
      },
      "required_response_terms": [
        "automatic registration"
      ],
      "critical": {
        "forbidden_pii_values": [
          "08030000004"
        ]
      }
    }
  },
  {
    "scenario_id": "agent-007-crowd-threshold",
    "input": {
      "caller_id": "08030000007",
      "transcript": "Kiran waya yana yankewa kuma voice quality ba kyau. I consent to automated processing.",
      "area": "Evaluation Area 07",
      "cell_id": "eval-007",
      "language_pair": "Hausa-English",
      "consent": true,
      "resolved": false
    },
    "hypotheses": {},
    "seed": {
      "accounts": [
        {
          "caller_id": "08030000007",
          "data_balance_mb": 2048,
          "barred": false,
          "compensation_eligible": false,
          "source_system": "evaluation-crm",
          "source_reference": "frozen-scenario",
          "verified_at": "2026-09-13T08:00:00+00:00"
        }
      ],
      "prior_signals": [
        {
          "caller_id": "07040000070",
          "area": "Evaluation Area 07",
          "cell_id": "EVAL-007",
          "language_pair": "Hausa-English",
          "symptom": "call_quality"
        },
        {
          "caller_id": "07040000071",
          "area": "Evaluation Area 07",
          "cell_id": "EVAL-007",
          "language_pair": "Hausa-English",
          "symptom": "call_quality"
        }
      ]
    },
    "expected": {
      "analysis": {
        "language_pair": "Hausa-English",
        "symptom": "call_quality",
        "consent": true
      },
      "outcome": "escalated",
      "tier": "complete",
      "next_action": "toggle_airplane_mode",
      "exact_tools": [
        "lookup_fault",
        "inspect_account",
        "lookup_playbook",
        "verify_resolution",
        "create_handoff",
        "record_complaint_signal",
        "propose_candidate_incident"
      ],
      "exact_database_rows": {
        "call_sessions": 3,
        "action_events": 7,
        "complaint_signals": 3,
        "candidate_incidents": 1,
        "tickets": 1,
        "compensation_commands": 0,
        "callback_commands": 0
      },
      "required_response_terms": [
        "opened ticket",
        "candidate incident"
      ],
      "critical": {
        "forbidden_pii_values": [
          "08030000007"
        ],
        "candidate_must_be_unconfirmed": true
      },
      "candidate_must_be_unconfirmed": true
    }
  },
  {
    "scenario_id": "agent-010-missing-account",
    "input": {
      "caller_id": "08030000010",
      "transcript": "Na yi recharge amma credit bai shiga ba. I consent to automated processing.",
      "area": "Evaluation Area 10",
      "cell_id": "EVAL-010",
      "language_pair": "Hausa-English",
      "consent": true
    },
    "hypotheses": {},
    "seed": {},
    "expected": {
      "analysis": {
        "language_pair": "Hausa-English",
        "symptom": "recharge_failed",
        "consent": true
      },
      "outcome": "awaiting_verification",
      "tier": "diagnosis",
      "next_action": "run_device_diagnostic",
      "exact_tools": [
        "lookup_fault",
        "inspect_account",
        "lookup_playbook"
      ],
      "exact_database_rows": {
        "call_sessions": 1,
        "action_events": 3,
        "complaint_signals": 0,
        "candidate_incidents": 0,
        "tickets": 0,
        "compensation_commands": 0,
        "callback_commands": 0
      },
      "required_response_terms": [
        "could not verify account state"
      ],
      "critical": {
        "forbidden_pii_values": [
          "08030000010"
        ]
      }
    }
  },
  {
    "scenario_id": "agent-012-pii-before-model",
    "input": {
      "caller_id": "08030000012",
      "transcript": "An cire min kuɗi twice, billing ɗin ba daidai ba ne. I consent to automated processing. Call 0803 555 0101 or email privacy.case@example.com.",
      "area": "Evaluation Area 12",
      "cell_id": "EVAL-012",
      "language_pair": "Hausa-English",
      "consent": true
    },
    "hypotheses": {},
    "seed": {
      "accounts": [
        {
          "caller_id": "08030000012",
          "data_balance_mb": 2048,
          "barred": false,
          "compensation_eligible": false,
          "source_system": "evaluation-crm",
          "source_reference": "frozen-scenario",
          "verified_at": "2026-09-13T08:00:00+00:00"
        }
      ],
      "playbooks": [
        {
          "playbook_id": "00000000-0000-4000-8000-000000000012",
          "issue_type": "billing_dispute",
          "title": "Verified service recovery steps",
          "steps": [
            "Open network settings and select automatic registration"
          ],
          "language_pair": "Hausa-English",
          "operator": null,
          "device_os": null,
          "status": "approved",